{
  "$schema": "http://json-schema.org/draft-07/schema#",
  "$id": "https://astrid.local/schemas/rendering/v1/support.json",
  "title": "Astrid renderer support report v1",
  "type": "object",
  "additionalProperties": false,
  "required": [
    "schema_version",
    "supported",
    "reasons",
    "features",
    "alternatives",
    "backend",
    "backend_version"
  ],
  "properties": {
    "schema_version": {
      "type": "integer",
      "const": 1
    },
    "supported": {
      "type": "boolean"
    },
    "reasons": {
      "type": "array",
      "items": {
        "type": "string",
        "minLength": 1,
        "pattern": "^(?![\\s\\S]*\\u0000)[\\s\\S]*\\S[\\s\\S]*(?![\\s\\S])"
      }
    },
    "features": {
      "type": "object",
      "additionalProperties": {
        "type": [
          "boolean",
          "string"
        ]
      },
      "propertyNames": {
        "pattern": "^(?![\\s\\S]*\\u0000)[\\s\\S]*\\S[\\s\\S]*(?![\\s\\S])"
      }
    },
    "alternatives": {
      "type": "array",
      "uniqueItems": true,
      "items": {
        "$ref": "#/definitions/qualifiedId"
      }
    },
    "backend": {
      "$ref": "#/definitions/qualifiedId"
    },
    "backend_version": {
      "type": [
        "string",
        "null"
      ],
      "minLength": 1,
      "pattern": "^(?![\\s\\S]*\\u0000)[\\s\\S]*\\S[\\s\\S]*(?![\\s\\S])"
    }
  },
  "definitions": {
    "qualifiedId": {
      "type": "string",
      "pattern": "^[a-z0-9][a-z0-9_-]*(?:\\.[a-z0-9][a-z0-9_-]*)+(?![\\s\\S])"
    }
  },
  "examples": [
    {
      "schema_version": 1,
      "supported": true,
      "reasons": [],
      "features": {
        "media": true,
        "audio_mode": "rendered"
      },
      "alternatives": [],
      "backend": "acme.example",
      "backend_version": "1.0.0"
    }
  ]
}
