{
  "alternatives": [],
  "backend": "rendering.legacy_hybrid",
  "backend_version": "1.0.0",
  "features": {
    "explicit_finalizer": true,
    "integer_frame_windows": true,
    "non_recursive_dispatch": true,
    "support_based_assignment": true,
    "transition_handles": true
  },
  "reasons": [],
  "schema_version": 1,
  "supported": true
}
