{
  "alternatives": [],
  "backend": "rendering.ffmpeg-finalizer",
  "backend_version": "1.0.0",
  "features": {
    "audio_ownership": "rendered",
    "preserves_attachments": true,
    "profile_normalization": true,
    "stream_copy": true,
    "strict_probe": true
  },
  "reasons": [],
  "schema_version": 1,
  "supported": true
}
